{
  "v": 1,
  "id": "01K8F40000000000000000005A",
  "ts": 1792900000,
  "host": "work",
  "type": "media.now_playing",
  "data": {
    "title": "Night Build",
    "artist": "Tabstop",
    "length_s": 247,
    "position_s": 12,
    "playing": true,
    "cover": {
      "hash": "b58977c6b2d76b25"
    }
  }
}
