{
  "v": 1,
  "id": "01K8F400000000000000000040",
  "ts": 1792900000,
  "host": "work",
  "type": "agent.needs_permission",
  "data": {
    "request_id": "01K8F3Z9QW4Y6R2M7N5P8T0V2A",
    "session": "7f3a9c1e-2b4d-4e8f-9a01-5c6d7e8f9a0b",
    "project": "payments-api",
    "tool": "Bash",
    "detail": "cat > scripts/seed-ledger.sh <<'SH' #!/bin/sh set -eu for merchant in acme globex initech umbrella hooli; do   curl -sf -X POST http://localhost:4000/api/merchants -H 'content-type: application/json' -d \"{\\\"name\\\":\\\"$merchant\\\"}\" done psql \"$DATABASE_URL\" -f db/seed/ledger.sql psql \"$DATABASE_URL\" …",
    "detail_full": "cat > scripts/seed-ledger.sh <<'SH'\n#!/bin/sh\nset -eu\nfor merchant in acme globex initech umbrella hooli; do\n  curl -sf -X POST http://localhost:4000/api/merchants -H 'content-type: application/json' -d \"{\\\"name\\\":\\\"$merchant\\\"}\"\ndone\npsql \"$DATABASE_URL\" -f db/seed/ledger.sql\npsql \"$DATABASE_URL\" -c 'select count(*) from ledger_entries'\nSH\nchmod +x scripts/seed-ledger.sh && scripts/seed-ledger.sh",
    "why": "Seed the local ledger with five merchants before the reconciliation tests.",
    "cwd": "~/code/payments-api",
    "risk": "high",
    "remote_allowed": true,
    "expires_at": 1792900600
  }
}
