{
  "v": 1,
  "id": "01K8F400000000000000000064",
  "ts": 1792900000,
  "host": "home",
  "type": "snapshot",
  "data": {
    "sessions": [],
    "usage": { "session_pct": 12, "weekly_pct": 8, "reset_in_min": 200 },
    "hilo": { "current": null, "next": [], "agreements_today": [] },
    "media_enabled": false
  }
}
